{
  "audit_skill": "paper-writing",
  "verdict": "PASS",
  "reason_code": "claims_evidence_aligned",
  "summary": "Every claim in the minimal draft maps to a numeric-fidelity result (RESULT.json) or a verified derivation step (PROOF_AUDIT.json); no overclaim, no negative-result dressing, no AIGC-pattern violations.",
  "audited_input_hashes": {
    "PROBLEM.md": "sha256:c50b0f8358cb3097ce89730b3e6b1be89149c74ac7f548cbbee282f495fdfbcb",
    "METHOD_REGISTRY_SNIPPET.md": "sha256:2aad820cbf564f3d9590d755d551b0062b3e9e24e6aaacc4364102e4dbb3ee69",
    "AGENT_DOC.md": "sha256:11a0152100ed8b108b5451855eb9420eef4f85ed0310de17cd891e83ef1dbb24",
    "run_toy.py": "sha256:036a87da9e49c948fdee002b8879e5ad9363e60b917757e43506ee2887a957a9"
  },
  "generated_at": "2026-08-09T00:00:00Z",
  "trace_path": "Q001/logs/traces/paper-writing/",
  "aigc_scan": {
    "blacklist_phrase_counts": {},
    "sentence_length_std_ok": true,
    "dash_count": 0,
    "report_style_detected": false
  }
}
